<!ELEMENT dealership (car+)>
<!ELEMENT car (model, brand+, year, price?)>
<!ELEMENT model (#PCDATA)>
<!ELEMENT brand (#PCDATA)>
<!ELEMENT year (#PCDATA)>
<!ELEMENT price (#PCDATA)>
